[
  {
    "id": "information_attention_shadow",
    "name": "注意力入口阴影",
    "shadow_family": "informational",
    "core_mechanism": "数字人的信息过滤器在搜索之前就决定哪些变量有机会进入视野，未进入注意力入口的信息不会在后续推理中留下缺席痕迹。",
    "generation_chain": ["认知身份证给出来源偏好", "搜索词沿偏好扩展", "低匹配材料被忽略", "结论误以为账本代表世界"],
    "chain_stages": ["information_filter", "evidence_selection"],
    "visible_signals": ["ignored_sources 高", "preferred_queries 同质化", "ignored_evidence 与问题关键变量重叠"],
    "capture_questions": ["哪些信息从一开始就没有被允许进入？", "被忽略证据代表哪个现实变量？", "忽略是低质量，还是低亲和？"],
    "false_positive_risks": ["把合理过滤误判为盲区", "把垃圾来源当作被压制真相"],
    "false_negative_risks": ["只分析采信证据，看不见入口前的沉默"],
    "linked_lenses": ["social_influence", "bias_heuristics", "emotion_reason"],
    "puzzle_material": "negative_space"
  },
  {
    "id": "source_trust_shadow",
    "name": "来源信任阴影",
    "shadow_family": "informational",
    "core_mechanism": "来源类型、权威地位、身份亲近和专业同温层塑造信任阈值，使某些证据被更宽容地采信，另一些被更严格地排除。",
    "generation_chain": ["身份/专业域设置信任阈值", "同温层来源被宽松评估", "外群体来源被严格评估", "证据质量与来源身份混合"],
    "chain_stages": ["information_filter", "evidence_selection"],
    "visible_signals": ["accepted_sources 与 persona 身份重叠", "rejected_sources 多为外群体", "trust_reason 依赖权威或亲近"],
    "capture_questions": ["信任来自方法质量还是身份亲近？", "同样证据换来源会被同样处理吗？"],
    "false_positive_risks": ["把专业质量误判为权威偏见"],
    "false_negative_risks": ["把权威来源的声望当成证据质量"],
    "linked_lenses": ["social_influence", "expert_failure"],
    "puzzle_material": "constraint_band"
  },
  {
    "id": "evidence_type_shadow",
    "name": "证据类型偏食",
    "shadow_family": "informational",
    "core_mechanism": "数字人偏好统计、案例、叙事、规范、市场数据或专家判断中的某几类，导致其他证据类型的现实信息被系统性低估。",
    "generation_chain": ["证据偏好设定入口", "不合口味证据被忽略或降权", "推理只在单一证据通道内闭合"],
    "chain_stages": ["evidence_selection", "reasoning"],
    "visible_signals": ["entries 来源类型单一", "ignored_sources 中某证据类型集中", "结论声称整体但证据类型局部"],
    "capture_questions": ["这个问题至少需要哪些证据类型？", "哪类证据被系统性低估？"],
    "false_positive_risks": ["强行要求所有证据类型齐全"],
    "false_negative_risks": ["误把单一证据通道当完整图景"],
    "linked_lenses": ["argument_forensics", "emotion_reason", "expert_failure"],
    "puzzle_material": "downweight"
  },
  {
    "id": "assumption_freeze_shadow",
    "name": "隐含假设冻结",
    "shadow_family": "assumption",
    "core_mechanism": "数字人在早期把未经审计的前提冻结成分析底座，后续证据只在该底座上移动，无法挑战底座本身。",
    "generation_chain": ["问题被快速定义", "关键前提未显性化", "证据只检验前提内变量", "结论继承前提盲区"],
    "chain_stages": ["assumption", "reasoning"],
    "visible_signals": ["结论依赖未列前提", "反证挑战前提但未被处理", "reasoning_path 缺少定义和边界"],
    "capture_questions": ["这个结论必须假设什么？", "哪个假设一旦错，整条推理会塌？"],
    "false_positive_risks": ["把普通前提都当成漏洞"],
    "false_negative_risks": ["只看证据，不审计证据站立的地面"],
    "linked_lenses": ["argument_forensics", "interpreter"],
    "puzzle_material": "fracture_boundary"
  },
  {
    "id": "frame_compression_shadow",
    "name": "框架压缩阴影",
    "shadow_family": "framing",
    "core_mechanism": "数字人用熟悉框架压缩问题，使某些维度被清晰化，另一些维度被挤出问题定义。",
    "generation_chain": ["选择主框架", "问题变量被重命名", "框架外变量不可见", "结论只在框架内成立"],
    "chain_stages": ["assumption", "reasoning", "conclusion"],
    "visible_signals": ["cognitive_frames 单一", "问题语言高度专业化", "其他框架的核心变量缺席"],
    "capture_questions": ["这个框架让什么变清楚？又让什么消失？", "换框架后问题对象是否改变？"],
    "false_positive_risks": ["把必要简化误判为压缩阴影"],
    "false_negative_risks": ["把框架内高清误认为整体高清"],
    "linked_lenses": ["paradigm", "expert_failure"],
    "puzzle_material": "constraint_band"
  },
  {
    "id": "value_magnification_shadow",
    "name": "价值放大阴影",
    "shadow_family": "value",
    "core_mechanism": "最高价值权重使相关收益、伤害或权利变得更显著，其他价值被压低，结论沿价值斜坡滑动。",
    "generation_chain": ["价值权重排序", "相关事实显著性上升", "反向价值代价被低估", "结论方向稳定偏移"],
    "chain_stages": ["value_evaluation", "conclusion"],
    "visible_signals": ["top_value 权重高", "结论与 top_value 同向", "其他价值只形式性出现"],
    "capture_questions": ["哪个价值在放大事实？", "被压低的价值代价是什么？"],
    "false_positive_risks": ["把明确价值立场误判为错误"],
    "false_negative_risks": ["假装价值评估是纯事实判断"],
    "linked_lenses": ["bias_heuristics", "paradigm", "emotion_reason"],
    "puzzle_material": "constraint_band"
  },
  {
    "id": "emotion_salience_shadow",
    "name": "情绪显著性阴影",
    "shadow_family": "value",
    "core_mechanism": "气质和情绪基调改变风险、机会、伤害和尊严成本的显著性，使某些后果被放大或被麻木化。",
    "generation_chain": ["气质设定注意方向", "情绪标记后果显著性", "证据被情绪权重重新排序", "行动建议偏向趋近或回避"],
    "chain_stages": ["information_filter", "value_evaluation"],
    "visible_signals": ["temperament 与结论方向一致", "低概率高情绪后果支配结论", "受影响者经验被放大或排除"],
    "capture_questions": ["情绪提供价值信号，还是扭曲概率？", "被冷静语言遮蔽的人类成本是什么？"],
    "false_positive_risks": ["把真实伤害当成情绪噪声"],
    "false_negative_risks": ["把强烈情绪当成事实强度"],
    "linked_lenses": ["emotion_reason", "bias_heuristics"],
    "puzzle_material": "constraint_band"
  },
  {
    "id": "post_hoc_narrative_shadow",
    "name": "事后叙事阴影",
    "shadow_family": "reasoning",
    "core_mechanism": "结论先由身份、价值、直觉或无意识加工生成，推理链随后为它编造连续故事。",
    "generation_chain": ["隐性倾向形成", "选择支持性证据", "推理链被整理为顺滑故事", "反证被重写或排除"],
    "chain_stages": ["assumption", "reasoning", "conclusion"],
    "visible_signals": ["reasoning_path 过于整齐", "what_would_change_my_mind 空泛", "结论与身份价值高度同向"],
    "capture_questions": ["理由删掉后结论会变吗？", "改变主意条件是否真实可触发？"],
    "false_positive_risks": ["把清晰表达误判为包装"],
    "false_negative_risks": ["被漂亮叙事说服"],
    "linked_lenses": ["interpreter", "bias_heuristics"],
    "puzzle_material": "downweight"
  },
  {
    "id": "reasoning_gap_shadow",
    "name": "推理断裂阴影",
    "shadow_family": "reasoning",
    "core_mechanism": "证据与结论之间缺少必要桥梁，数字人从局部事实、个案、相关性或短期结果跳到整体结论。",
    "generation_chain": ["采信局部证据", "省略中间机制", "跨尺度或跨时间外推", "输出强结论"],
    "chain_stages": ["reasoning", "conclusion"],
    "visible_signals": ["entries 少但结论大", "因果机制缺失", "尺度从个体跳到系统"],
    "capture_questions": ["证据实际支持到哪一步？", "哪一步需要补桥？"],
    "false_positive_risks": ["对复杂现实要求过高证据标准"],
    "false_negative_risks": ["把流畅因果语言当成因果证据"],
    "linked_lenses": ["argument_forensics"],
    "puzzle_material": "fracture_boundary"
  },
  {
    "id": "scale_translation_shadow",
    "name": "尺度翻译阴影",
    "shadow_family": "reasoning",
    "core_mechanism": "数字人在个体、组织、城市、国家、长期系统之间迁移判断，却没有补充尺度转换所需的新变量。",
    "generation_chain": ["局部观察形成", "忽略尺度转换变量", "外推到更大/更久层级", "结论越界"],
    "chain_stages": ["reasoning", "conclusion"],
    "visible_signals": ["短期推长期", "试点推全面", "个体体验推结构结论"],
    "capture_questions": ["这个结论跨了哪些尺度？", "跨尺度后新增变量是什么？"],
    "false_positive_risks": ["把合理外推一律打断"],
    "false_negative_risks": ["把局部高清当成整体真相"],
    "linked_lenses": ["argument_forensics", "expert_failure"],
    "puzzle_material": "fracture_boundary"
  },
  {
    "id": "expert_tunnel_shadow",
    "name": "专家隧道阴影",
    "shadow_family": "framing",
    "core_mechanism": "专业训练提升域内可见度，同时把域外变量变成低分辨率背景，导致局部高清与整体失真并存。",
    "generation_chain": ["专业域强化", "域内证据被优先采信", "域外证据被低估", "域内工具跨域外推"],
    "chain_stages": ["evidence_selection", "assumption", "reasoning"],
    "visible_signals": ["accepted_sources 与 expertise_strong 同域", "跨域结论强", "反例被专业术语吸收"],
    "capture_questions": ["它在哪个局部真的看得清？跨出哪里开始失真？"],
    "false_positive_risks": ["反专家化，丢掉域内锚点"],
    "false_negative_risks": ["被知识密度迷惑"],
    "linked_lenses": ["expert_failure"],
    "puzzle_material": "anchor"
  },
  {
    "id": "paradigm_blindness_shadow",
    "name": "范式盲视阴影",
    "shadow_family": "framing",
    "core_mechanism": "数字人的范式决定什么算事实、问题和成功标准，另一范式中的核心变量在本范式中不存在。",
    "generation_chain": ["范式设定对象", "证据被理论负载", "不可翻译变量消失", "分歧被误判为对方不理性"],
    "chain_stages": ["assumption", "reasoning", "value_evaluation"],
    "visible_signals": ["同一证据意义相反", "核心概念无法互译", "补事实不收敛"],
    "capture_questions": ["双方是否在看同一只象？", "哪个变量在一方语言中不存在？"],
    "false_positive_risks": ["把普通歧义升级成不可通约"],
    "false_negative_risks": ["强行平均不可通约冲突"],
    "linked_lenses": ["paradigm"],
    "puzzle_material": "negative_space"
  },
  {
    "id": "silence_collective_shadow",
    "name": "集体沉默阴影",
    "shadow_family": "silence",
    "core_mechanism": "不同数字人虽然偏见方向不同，却共同忽略同一证据类型或变量，形成群体层面的负空间。",
    "generation_chain": ["多个过滤器各自筛选", "同一变量反复未进入账本", "分歧掩盖共同沉默", "未知洞被误认为不重要"],
    "chain_stages": ["information_filter", "evidence_selection", "meta_audit"],
    "visible_signals": ["某 evidence_type ignored_count 高于 accepted_count", "所有阵营都少提同一变量", "争论激烈但共同缺席"],
    "capture_questions": ["所有人都没有摸到哪里？", "争论背后的共同沉默是什么？"],
    "false_positive_risks": ["把低质量证据缺席误判为盲区"],
    "false_negative_risks": ["被分歧吸引，忘记看共同空白"],
    "linked_lenses": ["emotion_reason", "ecological_rationality", "paradigm"],
    "puzzle_material": "negative_space"
  },
  {
    "id": "noise_disguised_shadow",
    "name": "噪声伪装阴影",
    "shadow_family": "distorted",
    "core_mechanism": "无稳定方向的随机判断差异被数字人或元模型解释成深层结构，制造伪阴影。",
    "generation_chain": ["判准模糊", "判断随机漂移", "每个漂移都有局部理由", "元模型过度解释"],
    "chain_stages": ["reasoning", "conclusion", "meta_audit"],
    "visible_signals": ["相似 persona 判断分散", "差异不沿价值/框架聚类", "重复采样可能漂移"],
    "capture_questions": ["这是结构性分歧，还是判断噪声？", "是否需要误差棒而非解释？"],
    "false_positive_risks": ["把真实新结构当噪声"],
    "false_negative_risks": ["把随机差异理论化"],
    "linked_lenses": ["noise"],
    "puzzle_material": "downweight"
  },
  {
    "id": "ecological_mismatch_shadow",
    "name": "生态错配阴影",
    "shadow_family": "distorted",
    "core_mechanism": "原环境中有效的启发式被迁移到结构不同的新环境，适应性规则变成偏见。",
    "generation_chain": ["旧环境形成简化规则", "规则被跨域迁移", "新环境反馈结构不同", "判断僵化失配"],
    "chain_stages": ["information_filter", "reasoning", "value_evaluation"],
    "visible_signals": ["旧经验解释新技术", "地方规则跨域外推", "反馈延迟被忽略"],
    "capture_questions": ["这个规则从哪里长出来？当前环境还一样吗？"],
    "false_positive_risks": ["把地方智慧都当错配"],
    "false_negative_risks": ["浪漫化旧经验"],
    "linked_lenses": ["ecological_rationality", "bias_heuristics"],
    "puzzle_material": "constraint_band"
  },
  {
    "id": "power_visibility_shadow",
    "name": "权力可见性阴影",
    "shadow_family": "informational",
    "core_mechanism": "高地位群体、制度语言和可量化指标更容易进入账本，低声量群体和非正式经验被系统性压低。",
    "generation_chain": ["权力决定可见来源", "制度材料被优先采信", "低声量经验缺席", "结论误把可见性当重要性"],
    "chain_stages": ["information_filter", "evidence_selection", "value_evaluation"],
    "visible_signals": ["权威报告多、边缘访谈少", "弱势群体只作为对象不作为来源", "制度成本清晰而生活成本模糊"],